{
  "analyzer_version": "0.1.0",
  "child_sas": [
    {
      "block_size_bytes": {
        "confidence": 0.0,
        "evidence": "unknown",
        "reason": "only 1 distinct ESP payload length(s) over 115 packets, so the residues describe the traffic shape rather than the cipher padding; this SA carries near-constant-size packets and needs varied plaintext sizes to tell the modes apart",
        "resolvable_by": "longer_capture",
        "value": null
      },
      "byte_count": 23000,
      "cipher_family": {
        "confidence": 0.0,
        "evidence": "unknown",
        "reason": "only 1 distinct ESP payload length(s) over 115 packets, so the residues describe the traffic shape rather than the cipher padding; this SA carries near-constant-size packets and needs varied plaintext sizes to tell the modes apart",
        "resolvable_by": "longer_capture",
        "value": null
      },
      "direction_pair_spi": "cd002a70",
      "dst": "10.80.0.3",
      "first_seen": 1791277839.784,
      "integ": {
        "confidence": 0.0,
        "evidence": "unknown",
        "reason": "the ESP integrity algorithm is negotiated inside the encrypted child SA exchange; the ICV length narrows the candidates but does not pick one",
        "resolvable_by": "supply_keys",
        "value": null
      },
      "key_length": {
        "confidence": 0.0,
        "evidence": "unknown",
        "reason": "ESP key length is not recoverable from ciphertext: AES-128 and AES-256 differ in round count, not in block or output size, so they produce identically shaped ESP payloads",
        "resolvable_by": "supply_keys",
        "value": null
      },
      "last_seen": 1791277884.336,
      "length_histogram": {
        "192": 115
      },
      "mode": {
        "confidence": 0.0,
        "evidence": "unknown",
        "reason": "distinguishing Tunnel from Transport mode needs the inner-header overhead model from phase 4, which is not implemented yet; the ESP child SA negotiation that would state it outright is encrypted",
        "resolvable_by": "supply_keys",
        "value": null
      },
      "packet_count": 115,
      "pfs_on_rekey": {
        "confidence": 0.0,
        "evidence": "unknown",
        "reason": "PFS on the child SA rekey is judged from the size of the encrypted rekey exchange, which the phase 4 inference adds",
        "resolvable_by": "longer_capture",
        "value": null
      },
      "protocol": {
        "confidence": 1.0,
        "evidence": "observed",
        "note": "read from the IP protocol number on 230 packets",
        "packets": [
          1
        ],
        "value": "ESP"
      },
      "rekey_interval_s": {
        "confidence": 1.0,
        "evidence": "observed",
        "note": "measured from a single SPI change, so it is one sample of the lifetime and not necessarily the configured value",
        "packets": [
          0
        ],
        "value": 44.9
      },
      "replay_evidence": {
        "duplicate_seqs": 0,
        "esn_suspected": false,
        "gaps": 0,
        "highest_seq": 115,
        "monotonic": true,
        "reordered_seqs": 0
      },
      "spi": "ca9cc409",
      "src": "10.80.0.2",
      "traffic_type": {
        "confidence": 0.0,
        "evidence": "unknown",
        "reason": "traffic-type classification is the phase 4 model and is not trained yet",
        "resolvable_by": "not_resolvable",
        "value": null
      },
      "udp_encapsulated": {
        "confidence": 1.0,
        "evidence": "observed",
        "note": "ESP carried directly over IP, so no NAT traversal was needed",
        "packets": [
          1
        ],
        "value": false
      }
    },
    {
      "block_size_bytes": {
        "confidence": 0.0,
        "evidence": "unknown",
        "reason": "only 1 distinct ESP payload length(s) over 141 packets, so the residues describe the traffic shape rather than the cipher padding; this SA carries near-constant-size packets and needs varied plaintext sizes to tell the modes apart",
        "resolvable_by": "longer_capture",
        "value": null
      },
      "byte_count": 28200,
      "cipher_family": {
        "confidence": 0.0,
        "evidence": "unknown",
        "reason": "only 1 distinct ESP payload length(s) over 141 packets, so the residues describe the traffic shape rather than the cipher padding; this SA carries near-constant-size packets and needs varied plaintext sizes to tell the modes apart",
        "resolvable_by": "longer_capture",
        "value": null
      },
      "direction_pair_spi": "c8551e0b",
      "dst": "10.80.0.3",
      "first_seen": 1791277884.656,
      "integ": {
        "confidence": 0.0,
        "evidence": "unknown",
        "reason": "the ESP integrity algorithm is negotiated inside the encrypted child SA exchange; the ICV length narrows the candidates but does not pick one",
        "resolvable_by": "supply_keys",
        "value": null
      },
      "key_length": {
        "confidence": 0.0,
        "evidence": "unknown",
        "reason": "ESP key length is not recoverable from ciphertext: AES-128 and AES-256 differ in round count, not in block or output size, so they produce identically shaped ESP payloads",
        "resolvable_by": "supply_keys",
        "value": null
      },
      "last_seen": 1791277929.455,
      "length_histogram": {
        "192": 141
      },
      "mode": {
        "confidence": 0.0,
        "evidence": "unknown",
        "reason": "distinguishing Tunnel from Transport mode needs the inner-header overhead model from phase 4, which is not implemented yet; the ESP child SA negotiation that would state it outright is encrypted",
        "resolvable_by": "supply_keys",
        "value": null
      },
      "packet_count": 141,
      "pfs_on_rekey": {
        "confidence": 0.0,
        "evidence": "unknown",
        "reason": "PFS on the child SA rekey is judged from the size of the encrypted rekey exchange, which the phase 4 inference adds",
        "resolvable_by": "longer_capture",
        "value": null
      },
      "protocol": {
        "confidence": 1.0,
        "evidence": "observed",
        "note": "read from the IP protocol number on 282 packets",
        "packets": [
          1
        ],
        "value": "ESP"
      },
      "rekey_interval_s": {
        "confidence": 1.0,
        "evidence": "observed",
        "note": "measured from a single SPI change, so it is one sample of the lifetime and not necessarily the configured value",
        "packets": [
          0
        ],
        "value": 45.1
      },
      "replay_evidence": {
        "duplicate_seqs": 0,
        "esn_suspected": false,
        "gaps": 0,
        "highest_seq": 141,
        "monotonic": true,
        "reordered_seqs": 0
      },
      "spi": "c45225ca",
      "src": "10.80.0.2",
      "traffic_type": {
        "confidence": 0.0,
        "evidence": "unknown",
        "reason": "traffic-type classification is the phase 4 model and is not trained yet",
        "resolvable_by": "not_resolvable",
        "value": null
      },
      "udp_encapsulated": {
        "confidence": 1.0,
        "evidence": "observed",
        "note": "ESP carried directly over IP, so no NAT traversal was needed",
        "packets": [
          1
        ],
        "value": false
      }
    },
    {
      "block_size_bytes": {
        "confidence": 0.0,
        "evidence": "unknown",
        "reason": "only 1 distinct ESP payload length(s) over 33 packets, so the residues describe the traffic shape rather than the cipher padding; this SA carries near-constant-size packets and needs varied plaintext sizes to tell the modes apart",
        "resolvable_by": "longer_capture",
        "value": null
      },
      "byte_count": 6600,
      "cipher_family": {
        "confidence": 0.0,
        "evidence": "unknown",
        "reason": "only 1 distinct ESP payload length(s) over 33 packets, so the residues describe the traffic shape rather than the cipher padding; this SA carries near-constant-size packets and needs varied plaintext sizes to tell the modes apart",
        "resolvable_by": "longer_capture",
        "value": null
      },
      "direction_pair_spi": "c04cf873",
      "dst": "10.80.0.3",
      "first_seen": 1791277929.775,
      "integ": {
        "confidence": 0.0,
        "evidence": "unknown",
        "reason": "the ESP integrity algorithm is negotiated inside the encrypted child SA exchange; the ICV length narrows the candidates but does not pick one",
        "resolvable_by": "supply_keys",
        "value": null
      },
      "key_length": {
        "confidence": 0.0,
        "evidence": "unknown",
        "reason": "ESP key length is not recoverable from ciphertext: AES-128 and AES-256 differ in round count, not in block or output size, so they produce identically shaped ESP payloads",
        "resolvable_by": "supply_keys",
        "value": null
      },
      "last_seen": 1791277940.014,
      "length_histogram": {
        "192": 33
      },
      "mode": {
        "confidence": 0.0,
        "evidence": "unknown",
        "reason": "distinguishing Tunnel from Transport mode needs the inner-header overhead model from phase 4, which is not implemented yet; the ESP child SA negotiation that would state it outright is encrypted",
        "resolvable_by": "supply_keys",
        "value": null
      },
      "packet_count": 33,
      "pfs_on_rekey": {
        "confidence": 0.0,
        "evidence": "unknown",
        "reason": "PFS on the child SA rekey is judged from the size of the encrypted rekey exchange, which the phase 4 inference adds",
        "resolvable_by": "longer_capture",
        "value": null
      },
      "protocol": {
        "confidence": 1.0,
        "evidence": "observed",
        "note": "read from the IP protocol number on 66 packets",
        "packets": [
          1
        ],
        "value": "ESP"
      },
      "rekey_interval_s": {
        "confidence": 0.0,